{
  "available_count": 28,
  "schema_version": "1.0",
  "tool_count": 30,
  "tools": [
    {
      "category": "system",
      "description": "List every known tool and its readiness.",
      "input_schema": {
        "additionalProperties": false,
        "type": "object"
      },
      "mutates_workbook": false,
      "name": "list_tools",
      "requires_approval": false,
      "requires_backup": false,
      "requires_excel": false,
      "risk": "low",
      "safe_for_dry_run": true,
      "status": "available"
    },
    {
      "category": "safety",
      "description": "Detect the Excel container, protection, complexity, and safest engine.",
      "input_schema": {
        "additionalProperties": false,
        "properties": {
          "file": {
            "minLength": 1,
            "type": "string"
          }
        },
        "required": [
          "file"
        ],
        "type": "object"
      },
      "mutates_workbook": false,
      "name": "inspect_file",
      "requires_approval": false,
      "requires_backup": false,
      "requires_excel": false,
      "risk": "low",
      "safe_for_dry_run": true,
      "status": "available"
    },
    {
      "category": "safety",
      "description": "Create and verify a byte-for-byte backup plus JSON evidence.",
      "input_schema": {
        "additionalProperties": false,
        "properties": {
          "file": {
            "minLength": 1,
            "type": "string"
          }
        },
        "required": [
          "file"
        ],
        "type": "object"
      },
      "mutates_workbook": false,
      "name": "create_backup",
      "requires_approval": false,
      "requires_backup": false,
      "requires_excel": false,
      "risk": "low",
      "safe_for_dry_run": true,
      "status": "available"
    },
    {
      "category": "safety",
      "description": "Create a structured workbook inventory or full cell/style snapshot through Excel.",
      "input_schema": {
        "additionalProperties": false,
        "properties": {
          "file": {
            "minLength": 1,
            "type": "string"
          }
        },
        "required": [
          "file"
        ],
        "type": "object"
      },
      "mutates_workbook": false,
      "name": "snapshot_workbook",
      "requires_approval": false,
      "requires_backup": false,
      "requires_excel": true,
      "risk": "low",
      "safe_for_dry_run": true,
      "status": "available"
    },
    {
      "category": "safety",
      "description": "Back up, verify, open read-only, and snapshot before any edit.",
      "input_schema": {
        "additionalProperties": false,
        "properties": {
          "file": {
            "minLength": 1,
            "type": "string"
          }
        },
        "required": [
          "file"
        ],
        "type": "object"
      },
      "mutates_workbook": false,
      "name": "prepare_workbook",
      "requires_approval": false,
      "requires_backup": false,
      "requires_excel": true,
      "risk": "low",
      "safe_for_dry_run": true,
      "status": "available"
    },
    {
      "category": "recipe",
      "description": "Run the guarded August P&L update recipe.",
      "input_schema": {
        "additionalProperties": false,
        "properties": {
          "file": {
            "minLength": 1,
            "type": "string"
          }
        },
        "required": [
          "file"
        ],
        "type": "object"
      },
      "mutates_workbook": true,
      "name": "pnl_update_a08",
      "requires_approval": true,
      "requires_backup": true,
      "requires_excel": true,
      "risk": "low",
      "safe_for_dry_run": true,
      "status": "available"
    },
    {
      "category": "cells",
      "description": "Read values, formulas, and formats from an explicit range without changing the workbook.",
      "input_schema": {
        "additionalProperties": false,
        "properties": {
          "address": {
            "minLength": 1,
            "type": "string"
          },
          "file": {
            "minLength": 1,
            "type": "string"
          },
          "mode": {
            "enum": [
              "auto",
              "attach",
              "open"
            ]
          },
          "sheet": {
            "minLength": 1,
            "type": "string"
          }
        },
        "required": [
          "file",
          "sheet",
          "address"
        ],
        "type": "object"
      },
      "mutates_workbook": false,
      "name": "read_range",
      "requires_approval": false,
      "requires_backup": false,
      "requires_excel": true,
      "risk": "low",
      "safe_for_dry_run": true,
      "status": "available"
    },
    {
      "category": "cells",
      "description": "Clear cell contents only (never formatting, never rows/columns) from an exact bounded range on a working copy.",
      "input_schema": {
        "additionalProperties": false,
        "properties": {
          "expected_cell_count": {
            "minimum": 1,
            "type": "integer"
          }
        },
        "required": [
          "expected_cell_count"
        ],
        "type": "object"
      },
      "mutates_workbook": true,
      "name": "clear_range",
      "requires_approval": true,
      "requires_backup": true,
      "requires_excel": true,
      "risk": "low",
      "safe_for_dry_run": true,
      "status": "available"
    },
    {
      "category": "cells",
      "description": "Bulk-write values to a configured range on a working copy.",
      "input_schema": {
        "additionalProperties": false,
        "properties": {
          "values": {
            "items": {
              "type": "array"
            },
            "type": "array"
          }
        },
        "required": [
          "values"
        ],
        "type": "object"
      },
      "mutates_workbook": true,
      "name": "write_range",
      "requires_approval": true,
      "requires_backup": true,
      "requires_excel": true,
      "risk": "low",
      "safe_for_dry_run": true,
      "status": "available"
    },
    {
      "category": "cells",
      "description": "Set an exact rectangular formula matrix on a working copy.",
      "input_schema": {
        "additionalProperties": false,
        "properties": {
          "formulas": {
            "items": {
              "type": "array"
            },
            "type": "array"
          }
        },
        "required": [
          "formulas"
        ],
        "type": "object"
      },
      "mutates_workbook": true,
      "name": "set_formula",
      "requires_approval": true,
      "requires_backup": true,
      "requires_excel": true,
      "risk": "low",
      "safe_for_dry_run": true,
      "status": "available"
    },
    {
      "category": "formatting",
      "description": "Apply a whitelisted format patch to one bounded range.",
      "input_schema": {
        "additionalProperties": false,
        "properties": {
          "format": {
            "additionalProperties": false,
            "minProperties": 1,
            "properties": {
              "bold": {
                "type": "boolean"
              },
              "column_width": {
                "maximum": 255,
                "minimum": 0,
                "type": "number"
              },
              "fill_color": {
                "maximum": 16777215,
                "minimum": 0,
                "type": "integer"
              },
              "font_color": {
                "maximum": 16777215,
                "minimum": 0,
                "type": "integer"
              },
              "font_name": {
                "type": "string"
              },
              "font_size": {
                "maximum": 409,
                "minimum": 1,
                "type": "number"
              },
              "horizontal_alignment": {
                "enum": [
                  "general",
                  "left",
                  "center",
                  "right"
                ]
              },
              "italic": {
                "type": "boolean"
              },
              "number_format": {
                "type": "string"
              },
              "row_height": {
                "maximum": 409.5,
                "minimum": 0,
                "type": "number"
              },
              "vertical_alignment": {
                "enum": [
                  "top",
                  "center",
                  "bottom"
                ]
              },
              "wrap_text": {
                "type": "boolean"
              }
            },
            "type": "object"
          }
        },
        "required": [
          "format"
        ],
        "type": "object"
      },
      "mutates_workbook": true,
      "name": "format_range",
      "requires_approval": true,
      "requires_backup": true,
      "requires_excel": true,
      "risk": "low",
      "safe_for_dry_run": true,
      "status": "available"
    },
    {
      "category": "cells",
      "description": "Copy values, formulas, formats, or all content through Excel within the same open workbook.",
      "input_schema": {
        "additionalProperties": false,
        "properties": {
          "mode": {
            "enum": [
              "all",
              "values",
              "formulas",
              "formats"
            ]
          },
          "source": {
            "properties": {
              "address": {
                "type": "string"
              },
              "object_name": {
                "type": "string"
              },
              "sheet": {
                "type": "string"
              },
              "workbook_id": {
                "type": "string"
              }
            },
            "required": [
              "workbook_id"
            ],
            "type": "object"
          }
        },
        "required": [
          "source"